question,answer
클라우드 컴퓨팅이 무엇인가요?,"클라우드 컴퓨팅은 인터넷을 통해 서버, 스토리지, 데이터베이스, 네트워킹, 소프트웨어, 분석 및 인텔리전스 기능을 제공하는 것입니다."
AWS와 Azure의 주요한 차이점은 무엇인가요?,"AWS는 더 많은 서비스 및 글로벌 인프라를 제공하고, Azure는 기업용 솔루션 및 유연한 하이브리드 클라우드 환경을 제공합니다."
클라우드 보안에 대해 어떻게 이해하고 있나요?,"클라우드 보안은 데이터의 기밀성, 무결성, 가용성을 보장하고 클라우드 환경에서의 위협을 예방하기 위한 조치들을 포함합니다."
클라우드 서비스 모델에는 어떤 것들이 있나요?,"클라우드 서비스 모델에는 IaaS(Infrastructure as a Service), PaaS(Platform as a Service), SaaS(Software as a Service) 등이 있습니다."
클라우드 마이그레이션에 대해 설명해주세요.,"클라우드 마이그레이션은 온프레미스 시스템에서 클라우드로 데이터, 애플리케이션, 비즈니스 프로세스를 이전하는 과정을 말합니다."
클라우드 비용 최적화를 위한 전략은 무엇이 있나요?,"리소스의 규모 조정, 예약 인스턴스의 활용, 스토리지 관리 및 비용 트래킹 등을 통해 클라우드 비용을 최적화할 수 있습니다."
서버리스 컴퓨팅이 무엇인가요?,서버리스 컴퓨팅은 서버 관리 없이 코드 실행을 위한 환경을 제공하는 클라우드 컴퓨팅 모델입니다.
클라우드 환경에서의 백업 전략에 대해 설명해주세요.,"클라우드 환경에서의 백업은 데이터의 안전한 보존을 위해 정기적인 자동 백업, 데이터 복제, 복구 테스트 등을 포함하는 전략입니다."
클라우드 환경에서의 데이터 손실을 방지하기 위한 방법은 무엇이 있나요?,"데이터의 암호화, 접근 제어 및 모니터링, 백업 및 복구 계획 수립 등을 통해 데이터 손실을 방지할 수 있습니다."
클라우드 환경에서의 네트워크 보안에 대해 이해하고 있는지 설명해주세요.,"클라우드 환경에서의 네트워크 보안은 데이터 전송 중의 위협을 예방하기 위해 방화벽, 가상 사설 네트워크, 보안 그룹 등을 활용하는 것을 말합니다."
클라우드 환경에서의 스케일링에 대해 설명해주세요.,클라우드 환경에서의 스케일링은 서버 자원을 동적으로 확장 또는 축소하여 트래픽 증감에 대응하는 것을 말합니다.
클라우드 컴퓨팅의 장단점에 대해 설명해주세요.,"장점으로는 유연성, 확장성, 비용 절감 등이 있고, 단점으로는 보안 문제, 의존성, 네트워크 문제 등이 있습니다."
클라우드 환경에서의 데이터 무결성을 어떻게 보장하나요?,"데이터 무결성을 보장하기 위해 해시 함수, 디지털 서명, 데이터 복제 및 레드런던시를 활용하여 데이터의 정확성을 유지합니다."
클라우드 환경에서의 컴퓨팅 리소스 최적화를 위한 방법은 무엇이 있나요?,"자동 스케일링, 리소스 모니터링 및 최적화 도구, 부하 분산 등을 통해 컴퓨팅 리소스를 최적화할 수 있습니다."
클라우드 환경에서의 데이터 분석을 위한 도구들에 대해 아는 것이 있나요?,"클라우드 환경에서의 데이터 분석 도구로는 AWS의 Amazon Redshift, Google의 BigQuery, Microsoft의 Azure Synapse Analytics 등이 있습니다."
클라우드 환경에서의 데이터 이전을 위한 전략은 무엇이 있나요?,"데이터 이전을 위한 전략으로는 데이터 마이그레이션 도구 활용, 데이터 품질 평가, 이행 계획 수립 등이 있습니다."
클라우드 환경에서의 서비스 지속성을 보장하기 위한 방법은 무엇이 있나요?,"서비스 지속성을 보장하기 위해 지역 간 데이터 복제, 다중 가용 영역 활용, 자동 복구 기능 구현 등을 고려할 수 있습니다."
클라우드 환경에서의 실시간 데이터 처리를 위한 도구들에 대해 아는 것이 있나요?,"클라우드 환경에서의 실시간 데이터 처리를 위한 도구로는 Apache Kafka, AWS Kinesis, Google Cloud Dataflow 등이 있습니다."
클라우드 환경에서의 컨테이너 기술에 대해 설명해주세요.,"컨테이너 기술은 애플리케이션을 패키징하고 실행하는 데 사용되며, 가볍고 빠르게 배포 및 확장할 수 있는 장점을 가지고 있습니다."
클라우드 환경에서의 서버리스 아키텍처의 장단점은 무엇인가요?,"서버리스 아키텍처의 장점으로는 관리의 편의성, 비용 절감, 확장성이 있고, 단점으로는 실행 시간 제약, 환경 제한, 디버깅의 어려움 등이 있습니다."
클라우드 환경에서의 빅데이터 처리를 위한 도구들에 대해 아는 것이 있나요?,"클라우드 환경에서의 빅데이터 처리 도구로는 Apache Hadoop, Spark, AWS EMR, Google Cloud Dataproc 등이 있습니다."
클라우드 환경에서의 시스템 모니터링을 위해 사용하는 도구는 무엇이 있나요?,"클라우드 환경에서의 시스템 모니터링 도구로는 AWS CloudWatch, Google Stackdriver, Azure Monitor 등이 있습니다."
클라우드 환경에서의 자동화를 위해 사용하는 도구는 무엇이 있나요?,"클라우드 환경에서의 자동화 도구로는 AWS의 AWS Lambda, Google의 Cloud Functions, Azure의 Azure Automation 등이 있습니다."
클라우드 환경에서의 데이터 보관 및 아카이빙 전략을 어떻게 수립하나요?,"데이터 보관 및 아카이빙 전략은 데이터의 유지 기간, 접근 제어, 보안 등을 고려하여 데이터를 구분하고 관리하는 전략을 수립하는 것을 말합니다."
클라우드 환경에서의 컴퓨팅 자원 확장을 위한 방법은 무엇이 있나요?,"컴퓨팅 자원을 확장하기 위한 방법으로는 수평적 확장, 수직적 확장, 오토스케일링 등이 있습니다."
클라우드 환경에서의 데이터 레이크와 데이터 웨어하우스의 차이점은 무엇인가요?,"데이터 레이크는 비정형 데이터와 정형 데이터를 저장하는 데 사용되고, 데이터 웨어하우스는 분석을 위한 정형 데이터를 중심으로 구축됩니다."
클라우드 환경에서의 보안 인증 및 접근 제어에 대해 설명해주세요.,"보안 인증 및 접근 제어는 사용자의 신원 확인, 권한 부여, 접근 제어를 통해 시스템의 보안을 유지하는 데 중요한 요소입니다."
클라우드 환경에서의 머신러닝 모델 배포를 위한 도구들에 대해 아는 것이 있나요?,"클라우드 환경에서의 머신러닝 모델 배포 도구로는 AWS SageMaker, Google AI Platform, Azure Machine Learning 등이 있습니다."
클라우드 환경에서의 효율적인 비즈니스 인텔리전스 구축을 위한 전략은 무엇이 있나요?,"효율적인 비즈니스 인텔리전스 구축을 위한 전략으로는 데이터 통합, 시각화 도구 활용, 실시간 분석 및 예측 모델 적용 등이 있습니다."
클라우드 환경에서의 데이터 과학 프로젝트를 성공적으로 수행하기 위한 핵심 요소는 무엇인가요?,"데이터 품질 관리, 팀 협업 및 커뮤니케이션, 비즈니스 이해 및 도메인 지식, 지속적인 모델 평가 및 최적화 등이 중요한 요소입니다."
클라우드 환경에서의 유지보수성을 향상시키기 위한 전략은 무엇이 있나요?,"유지보수성을 향상시키기 위한 전략으로는 자동화된 테스트, 모니터링 및 경고 시스템 구축, 정기적인 시스템 업데이트 등이 있습니다."
클라우드 환경에서의 데이터 시각화를 위한 효과적인 도구는 무엇이 있나요?,"클라우드 환경에서의 데이터 시각화를 위한 도구로는 Tableau, Power BI, Google Data Studio 등이 있습니다."
클라우드 환경에서의 데이터 보안 및 규정 준수를 위한 전략은 무엇이 있나요?,"데이터 암호화, 접근 제어, 감사 로깅, 규정 준수를 위한 보고서 작성 등을 통해 데이터 보안 및 규정 준수를 유지할 수 있습니다."
클라우드 환경에서의 컴퓨팅 리소스 관리를 위한 방법은 무엇이 있나요?,"컴퓨팅 리소스 관리를 위한 방법으로는 비즈니스 필요에 따른 자원 할당, 비용 모니터링, 리소스 최적화 등이 있습니다."
클라우드 환경에서의 데이터 소실 및 유출 방지를 위한 정책은 어떻게 수립하나요?,"데이터 보호 정책 수립, 사용자 교육, 접근 권한 관리, 데이터 암호화 등을 통해 데이터 소실 및 유출을 방지하는 정책을 수립할 수 있습니다."
클라우드 환경에서의 인프라 구조 설계를 위한 고려해야 할 사항은 무엇인가요?,"인프라 구조 설계를 위한 고려 사항으로는 가용성, 확장성, 보안, 비용 효율성 등을 고려하여 최적의 아키텍처를 설계해야 합니다."
클라우드 환경에서의 데이터 소스 통합을 위한 전략은 무엇이 있나요?,"데이터 소스 통합을 위한 전략으로는 ETL 프로세스 구축, 데이터 웨어하우스 구축, 데이터 품질 관리 등을 고려할 수 있습니다."
클라우드 환경에서의 데이터 분석을 위한 효과적인 시각화 방법은 무엇이 있나요?,"데이터 분석을 위한 효과적인 시각화 방법으로는 다양한 차트 및 그래픽 활용, 대시보드 구축, 인사이트 도출을 위한 시각화 등이 있습니다."