question,answer
데이터 사이언티스트로서 기여하고자 하는 분야는 무엇인가요?,"저는 의료 분야에 데이터 사이언스를 활용하여 질병 예방과 치료에 기여하고 싶습니다. 예를 들어, 환자 데이터를 분석하여 개인 맞춤형 치료법을 개발하고 싶습니다."
데이터 분석 프로젝트를 통해 어떤 문제를 해결했나요?,저는 고객 이탈률을 낮추기 위해 고객 행동 데이터를 분석하여 이탈 고객의 특징을 파악하고 이를 예방하는 방안을 모색했습니다.
데이터 시각화 도구를 사용한 경험이 있나요?,"예, Tableau를 사용하여 매출 데이터를 시각화하여 경영진에게 보고서를 제공한 경험이 있습니다."
데이터 전처리 과정에서 주로 어떤 기술을 사용하나요?,"결측치 처리, 이상치 탐지, 데이터 정규화 등을 위해 주로 Python의 pandas 라이브러리를 사용합니다."
머신러닝 모델을 개발할 때 어떤 성능 지표를 주로 사용하나요?,"분류 모델의 경우 정확도, 정밀도, 재현율, F1-score를 주로 사용하고, 회귀 모델의 경우 평균 제곱 오차나 R제곱 값을 활용합니다."
빅데이터를 다루는 경험이 있나요?,"예, 대용량의 로그 데이터를 분석하여 시스템 성능 개선을 위한 인사이트를 도출한 경험이 있습니다."
프로젝트 중 어려움을 겪었을 때 해결한 경험이 있나요?,"예, 팀원 간의 커뮤니케이션 부족으로 인해 일정이 지연된 적이 있었는데, 일정을 재조정하고 업무 분담을 재조정하여 프로젝트를 성공적으로 마무리했습니다."
데이터 모델링을 할 때 주의해야 할 점은 무엇인가요?,"데이터 모델링 시 데이터의 정확성과 일관성을 유지하기 위해 데이터의 출처와 정의를 명확히해야 하며, 중복을 최소화하여 성능을 향상시켜야 합니다."
데이터베이스 관리 시스템을 사용한 경험이 있나요?,"예, MySQL을 사용하여 대용량 데이터베이스를 관리하고 SQL 쿼리를 작성한 경험이 있습니다."
코딩 테스트를 준비한 경험이 있나요?,"예, 알고리즘 문제를 풀고 이를 통해 파이썬 프로그래밍 능력을 향상시켰습니다."
데이터 사이언스 프로젝트에서 가장 자신 있는 부분은 무엇인가요?,저는 데이터 시각화와 인사이트 도출 부분에서 가장 자신감을 가지고 있습니다. 다양한 그래픽 도구를 활용하여 데이터를 쉽게 이해할 수 있는 형태로 변환시킬 수 있습니다.
데이터 수집 및 정제 과정에서 발생한 문제를 해결한 경험이 있나요?,"예, 웹 크롤링 중 로봇 배제 표준에 어긋나는 사이트로 인해 데이터 수집에 어려움을 겪은 적이 있었는데, User-Agent 설정을 통해 문제를 해결하였습니다."
데이터 분석 결과를 비전문가에게 효과적으로 전달한 경험이 있나요?,"예, 비즈니스팀에게 데이터 시각화 보고서를 제공하고, 결과 해석에 대한 교육을 진행하여 데이터에 기반한 의사결정을 도와드렸습니다."
새로운 데이터 분석 기술이나 도구를 학습한 경험이 있나요?,"예, 최근에는 딥러닝 기술을 학습하고 이미지 분석에 적용하는 공부를 하고 있습니다."
데이터 랭글링 경험을 공유해주세요.,"저는 다양한 데이터 소스에서 데이터를 수집하고, 이를 정제하고 변환하여 분석에 활용한 경험이 있습니다. 이를 통해 데이터 품질을 향상시키고 분석의 정확성을 확보했습니다."
프로젝트에서 데이터 속성을 선택하는 기준은 무엇인가요?,데이터 속성을 선택할 때는 분석 목적과 예측 성능 향상을 위한 특성 선택 알고리즘을 활용하여 중요한 속성을 선별합니다.
데이터 모델링을 할 때 normalization과 denormalization의 차이점은 무엇인가요?,"Normalization은 중복을 최소화하여 데이터를 구조화하는 과정이고, Denormalization은 성능 향상을 위해 중복을 허용하는 과정입니다."
데이터 시각화를 통해 발견한 인사이트 중 가장 기억에 남는 것은 무엇인가요?,"매출 데이터 시각화를 통해 특정 지역에서의 매출이 예상보다 낮았는데, 해당 지역의 마케팅 전략을 재조정하여 매출 증대에 성공한 경험이 있습니다."
데이터 사이언스를 위해 주로 사용하는 프로그래밍 언어는 무엇인가요?,주로 Python을 사용합니다. Python은 데이터 분석 및 머신러닝 라이브러리가 풍부하고 사용이 편리하여 데이터 사이언스에 적합한 언어입니다.
데이터 분석 프로젝트에서 가장 어려웠던 부분은 무엇이었나요?,데이터의 불균형으로 인한 클래스 불균형 문제가 어려웠습니다. 이를 해결하기 위해 오버샘플링 및 언더샘플링 기법을 적용하여 모델 성능을 향상시켰습니다.
데이터 분석 결과를 바탕으로 한 추천 시스템을 개발한 경험이 있나요?,"예, 사용자 행동 데이터를 분석하여 콘텐츠 기반 추천 시스템을 개발하고, 사용자에게 맞춤형 추천 콘텐츠를 제공한 경험이 있습니다."
데이터 시각화를 통해 어떤 인사이트를 발견했나요?,"매출 데이터를 지역별로 시각화하여 특정 지역의 매출이 다른 지역에 비해 낮았는데, 해당 지역의 경쟁사 분석을 통해 마케팅 전략을 재조정하여 매출 증대에 성공한 경험이 있습니다."
데이터 사이언스 프로젝트에서 가장 자랑할 만한 성과는 무엇인가요?,고객 이탈률을 20% 감소시키는데 성공하여 기업 매출 증대에 기여한 경험이 있습니다.
데이터 분석 프로젝트를 진행할 때 가장 중요하다고 생각하는 요소는 무엇인가요?,가장 중요한 것은 데이터의 품질과 정확성입니다. 잘못된 데이터로 분석을 한다면 잘못된 결론을 도출할 수 있기 때문에 데이터의 정확성을 확보하는 것이 중요합니다.
빅데이터를 다룰 때 가장 어려운 점은 무엇이라고 생각하나요?,"빅데이터를 다룰 때 가장 어려운 점은 데이터의 다양성과 신뢰성을 확보하는 것입니다. 다양한 소스의 데이터를 통합하고, 데이터의 신뢰성을 검증하는 것이 중요합니다."
데이터 분석 모델을 해석하고 설명할 수 있는 능력이 중요하다고 생각하나요?,"네, 데이터 분석 결과를 이해관계자에게 효과적으로 전달하기 위해서는 모델의 해석과 설명이 중요합니다. 비전문가도 이해할 수 있는 형태로 결과를 전달하는 것이 중요합니다."
데이터 사이언스 분야에서 더 깊이 연구하고 싶은 주제는 무엇인가요?,더 깊이 연구하고 싶은 주제는 인공지능과 머신러닝을 결합한 의료 진단 보조 시스템입니다. 의료 데이터를 분석하여 질병의 조기 진단과 예방을 위한 시스템을 개발하고 싶습니다.
데이터 사이언티스트로서 성공을 거둘 수 있는 역량은 무엇이라고 생각하나요?,데이터 사이언티스트로서 성공을 거둘 수 있는 역량은 데이터에 대한 깊은 이해와 문제 해결능력입니다. 데이터를 분석하고 모델을 개발하여 비즈니스에 가치를 제공할 수 있는 능력이 중요합니다.
데이터 사이언스 영역에서 발전하고자 하는 목표는 무엇인가요?,"데이터 사이언스 영역에서 발전하고자 하는 목표는 더 나은 예측 모델을 개발하고, 데이터를 효과적으로 시각화하여 의사결정에 활용할 수 있는 인사이트를 제공하는 것입니다."
데이터 사이언스 분야에서 가장 중요하다고 생각하는 역량은 무엇인가요?,데이터 사이언스 분야에서 가장 중요한 역량은 문제 해결능력과 커뮤니케이션 능력입니다. 문제를 정의하고 해결하기 위한 능력과 결과를 이해관계자에게 효과적으로 전달할 수 있는 능력이 필요합니다.
데이터 사이언스 분야에서 경쟁력을 갖추기 위해 필요한 역량은 무엇이라고 생각하나요?,데이터 사이언스 분야에서 경쟁력을 갖추기 위해 필요한 역량은 지속적인 학습과 새로운 기술 습득능력입니다. 빠르게 변화하는 기술과 트렌드에 대응하기 위해서는 항상 최신 정보를 습득해야 합니다.
